{
  "format": "morphoia.engine.ir-manifest",
  "format_version": "0.1.0",
  "media_type": "application/vnd.morphoia.ir-manifest.v0+json",
  "canonical_profile": "morphoia.canonical-json.profile1",
  "identity": {
    "algorithm": "sha256",
    "digest": "76378c36ee77bf483ce991f5095769d39b9916dcc3cdca9fc94028d6d1ee6aac",
    "scope": "content"
  },
  "content": {
    "logical_id": "018f0000-0000-7000-8000-000000000258",
    "revision": 1,
    "parents": [],
    "units": [
      {
        "id": "018f0000-0000-7000-8000-000000000259",
        "ucum_code": "mm",
        "dimension": {
          "length": 1,
          "mass": 0,
          "time": 0,
          "current": 0,
          "temperature": 0,
          "amount": 0,
          "luminous_intensity": 0
        },
        "si_factor": {
          "coefficient": 1,
          "scale": -3
        }
      }
    ],
    "frames": [
      {
        "id": "018f0000-0000-7000-8000-00000000025a",
        "dimension": 3,
        "origin": [
          {
            "coefficient": 0,
            "scale": 0
          },
          {
            "coefficient": 0,
            "scale": 0
          },
          {
            "coefficient": 0,
            "scale": 0
          }
        ],
        "axes": [
          1,
          0,
          0,
          0,
          1,
          0,
          0,
          0,
          1
        ],
        "handedness": "right",
        "matrix_order": "row-major",
        "unit_id": "018f0000-0000-7000-8000-000000000259"
      }
    ],
    "transforms": [],
    "source": {
      "uri": "urn:morphoia:fixture:graph-06",
      "license_expression": "CC-BY-4.0",
      "rights_holder": "Morphoia synthetic fixtures",
      "created_at": "2026-08-12T12:00:00Z",
      "source_tool": {
        "name": "morphoia-fixture-generator",
        "version": "0.1.0"
      },
      "artifact": {
        "uri": "morphoia-cas://sha256/5eb595adc35a67431461abb85130aa7a3a8b44efc0f320db63c533d7b2fa02e2",
        "sha256": "5eb595adc35a67431461abb85130aa7a3a8b44efc0f320db63c533d7b2fa02e2",
        "size_bytes": 72,
        "media_type": "model/step"
      }
    },
    "product": {
      "assemblies": [
        {
          "id": "018f0000-0000-7000-8000-00000000025b",
          "name": "Synthetic graph 06"
        }
      ],
      "instances": [],
      "names": [
        {
          "subject_id": "018f0000-0000-7000-8000-00000000025b",
          "value": "Synthetic graph 06"
        }
      ],
      "colors": [
        {
          "subject_id": "018f0000-0000-7000-8000-00000000025b",
          "rgba": [
            109,
            223,
            245,
            255
          ]
        }
      ],
      "layers": [
        {
          "subject_id": "018f0000-0000-7000-8000-00000000025b",
          "name": "fixture"
        }
      ],
      "properties": [
        {
          "subject_id": "018f0000-0000-7000-8000-00000000025b",
          "name": "synthetic",
          "value": true
        }
      ]
    },
    "representations": [
      {
        "id": "018f0000-0000-7000-8000-00000000025c",
        "kind": "brep",
        "authority": "source",
        "frame_id": "018f0000-0000-7000-8000-00000000025a",
        "unit_id": "018f0000-0000-7000-8000-000000000259",
        "payload": {
          "uri": "morphoia-cas://sha256/90695f0cf2a3e43963036d673e553faafc97aa792b93eeb942cdbfe682d13d96",
          "sha256": "90695f0cf2a3e43963036d673e553faafc97aa792b93eeb942cdbfe682d13d96",
          "size_bytes": 80,
          "media_type": "model/step"
        },
        "derived_from": [],
        "ai_output": false,
        "topology_identity": {
          "stable": true
        }
      },
      {
        "id": "018f0000-0000-7000-8000-00000000025e",
        "kind": "field",
        "authority": "derived",
        "frame_id": "018f0000-0000-7000-8000-00000000025a",
        "unit_id": "018f0000-0000-7000-8000-000000000259",
        "payload": {
          "uri": "morphoia-cas://sha256/585061fef38336a88b9d4d57aaa4a11565352e8d35db306a29fcf44159b5ff87",
          "sha256": "585061fef38336a88b9d4d57aaa4a11565352e8d35db306a29fcf44159b5ff87",
          "size_bytes": 73,
          "media_type": "application/octet-stream"
        },
        "derived_from": [
          "018f0000-0000-7000-8000-00000000025c"
        ],
        "ai_output": false,
        "topology_identity": {
          "stable": true
        }
      }
    ],
    "provenance": [
      {
        "id": "018f0000-0000-7000-8000-00000000025d",
        "activity": "synthetic-source",
        "tool": {
          "name": "morphoia-fixture-generator",
          "version": "0.1.0",
          "commit": "synthetic"
        },
        "parameters": {
          "fixture": true
        },
        "parents": [],
        "environment": {
          "profile": "core-cpu-synthetic",
          "os": "platform-independent"
        },
        "seeds": [
          605
        ],
        "started_at": "2026-08-12T12:00:00Z",
        "ended_at": "2026-08-12T12:00:01Z",
        "inputs": [],
        "outputs": [
          "018f0000-0000-7000-8000-00000000025c"
        ]
      },
      {
        "id": "018f0000-0000-7000-8000-00000000025f",
        "activity": "synthetic-derivation",
        "tool": {
          "name": "morphoia-fixture-generator",
          "version": "0.1.0",
          "commit": "synthetic"
        },
        "parameters": {
          "fixture": true
        },
        "parents": [
          "018f0000-0000-7000-8000-00000000025d"
        ],
        "environment": {
          "profile": "core-cpu-synthetic",
          "os": "platform-independent"
        },
        "seeds": [
          607
        ],
        "started_at": "2026-08-12T12:00:01Z",
        "ended_at": "2026-08-12T12:00:02Z",
        "inputs": [
          "018f0000-0000-7000-8000-00000000025c"
        ],
        "outputs": [
          "018f0000-0000-7000-8000-00000000025e"
        ]
      }
    ],
    "tolerances": [],
    "fidelity_events": [],
    "repairs": [],
    "losses": [],
    "security": {
      "classification": "public",
      "sensitivity": "none",
      "access_policy": "redistributable synthetic fixture",
      "signature": {
        "status": "unsigned",
        "algorithm": null,
        "value": null
      },
      "trust_level": "fixture"
    }
  }
}
