{
  "format": "morphoia.engine.ir-manifest",
  "format_version": "0.1.0",
  "media_type": "application/vnd.morphoia.ir-manifest.v0+json",
  "canonical_profile": "morphoia.canonical-json.profile1",
  "identity": {
    "algorithm": "sha256",
    "digest": "06d32edac9f3b9d15dee54dc1280257856a442279bd4eb9a8e5660e09311996d",
    "scope": "content"
  },
  "content": {
    "logical_id": "018f0000-0000-7000-8000-000000000384",
    "revision": 1,
    "parents": [],
    "units": [
      {
        "id": "018f0000-0000-7000-8000-000000000385",
        "ucum_code": "mm",
        "dimension": {
          "length": 1,
          "mass": 0,
          "time": 0,
          "current": 0,
          "temperature": 0,
          "amount": 0,
          "luminous_intensity": 0
        },
        "si_factor": {
          "coefficient": 1,
          "scale": -3
        }
      }
    ],
    "frames": [
      {
        "id": "018f0000-0000-7000-8000-000000000386",
        "dimension": 3,
        "origin": [
          {
            "coefficient": 0,
            "scale": 0
          },
          {
            "coefficient": 0,
            "scale": 0
          },
          {
            "coefficient": 0,
            "scale": 0
          }
        ],
        "axes": [
          1,
          0,
          0,
          0,
          1,
          0,
          0,
          0,
          1
        ],
        "handedness": "right",
        "matrix_order": "row-major",
        "unit_id": "018f0000-0000-7000-8000-000000000385"
      }
    ],
    "transforms": [],
    "source": {
      "uri": "urn:morphoia:fixture:graph-09",
      "license_expression": "CC-BY-4.0",
      "rights_holder": "Morphoia synthetic fixtures",
      "created_at": "2026-08-12T12:00:00Z",
      "source_tool": {
        "name": "morphoia-fixture-generator",
        "version": "0.1.0"
      },
      "artifact": {
        "uri": "morphoia-cas://sha256/6f8452267bf1fcc65c7892ad7b611834a8c26495152539f8ba8e366ae17ee2ef",
        "sha256": "6f8452267bf1fcc65c7892ad7b611834a8c26495152539f8ba8e366ae17ee2ef",
        "size_bytes": 72,
        "media_type": "model/step"
      }
    },
    "product": {
      "assemblies": [
        {
          "id": "018f0000-0000-7000-8000-000000000387",
          "name": "Synthetic graph 09"
        }
      ],
      "instances": [],
      "names": [
        {
          "subject_id": "018f0000-0000-7000-8000-000000000387",
          "value": "Synthetic graph 09"
        }
      ],
      "colors": [
        {
          "subject_id": "018f0000-0000-7000-8000-000000000387",
          "rgba": [
            109,
            223,
            245,
            255
          ]
        }
      ],
      "layers": [
        {
          "subject_id": "018f0000-0000-7000-8000-000000000387",
          "name": "fixture"
        }
      ],
      "properties": [
        {
          "subject_id": "018f0000-0000-7000-8000-000000000387",
          "name": "synthetic",
          "value": true
        }
      ]
    },
    "representations": [
      {
        "id": "018f0000-0000-7000-8000-000000000388",
        "kind": "brep",
        "authority": "source",
        "frame_id": "018f0000-0000-7000-8000-000000000386",
        "unit_id": "018f0000-0000-7000-8000-000000000385",
        "payload": {
          "uri": "morphoia-cas://sha256/c66235a55bf1ae27a0af92095de2c4ebe65cb5c361415bad441e9f6bd0c85212",
          "sha256": "c66235a55bf1ae27a0af92095de2c4ebe65cb5c361415bad441e9f6bd0c85212",
          "size_bytes": 80,
          "media_type": "model/step"
        },
        "derived_from": [],
        "ai_output": false,
        "topology_identity": {
          "stable": true
        }
      },
      {
        "id": "018f0000-0000-7000-8000-00000000038a",
        "kind": "tensor",
        "authority": "candidate",
        "frame_id": "018f0000-0000-7000-8000-000000000386",
        "unit_id": "018f0000-0000-7000-8000-000000000385",
        "payload": {
          "uri": "morphoia-cas://sha256/5e35d2f5eeded3912e69eafc87007abdc22f5ad50f1ca25b18602dd0068c14a4",
          "sha256": "5e35d2f5eeded3912e69eafc87007abdc22f5ad50f1ca25b18602dd0068c14a4",
          "size_bytes": 73,
          "media_type": "application/octet-stream"
        },
        "derived_from": [
          "018f0000-0000-7000-8000-000000000388"
        ],
        "ai_output": true,
        "topology_identity": {
          "stable": true
        }
      }
    ],
    "provenance": [
      {
        "id": "018f0000-0000-7000-8000-000000000389",
        "activity": "synthetic-source",
        "tool": {
          "name": "morphoia-fixture-generator",
          "version": "0.1.0",
          "commit": "synthetic"
        },
        "parameters": {
          "fixture": true
        },
        "parents": [],
        "environment": {
          "profile": "core-cpu-synthetic",
          "os": "platform-independent"
        },
        "seeds": [
          905
        ],
        "started_at": "2026-08-12T12:00:00Z",
        "ended_at": "2026-08-12T12:00:01Z",
        "inputs": [],
        "outputs": [
          "018f0000-0000-7000-8000-000000000388"
        ]
      },
      {
        "id": "018f0000-0000-7000-8000-00000000038b",
        "activity": "synthetic-derivation",
        "tool": {
          "name": "morphoia-fixture-generator",
          "version": "0.1.0",
          "commit": "synthetic"
        },
        "parameters": {
          "fixture": true
        },
        "parents": [
          "018f0000-0000-7000-8000-000000000389"
        ],
        "environment": {
          "profile": "core-cpu-synthetic",
          "os": "platform-independent"
        },
        "seeds": [
          907
        ],
        "started_at": "2026-08-12T12:00:01Z",
        "ended_at": "2026-08-12T12:00:02Z",
        "inputs": [
          "018f0000-0000-7000-8000-000000000388"
        ],
        "outputs": [
          "018f0000-0000-7000-8000-00000000038a"
        ]
      }
    ],
    "tolerances": [],
    "fidelity_events": [],
    "repairs": [],
    "losses": [],
    "security": {
      "classification": "public",
      "sensitivity": "none",
      "access_policy": "redistributable synthetic fixture",
      "signature": {
        "status": "unsigned",
        "algorithm": null,
        "value": null
      },
      "trust_level": "fixture"
    }
  }
}
